,asin,product_url,title,price,bought,review_count,rating
121,B0949JRVNQ,https://www.amazon.com/dp/B0949JRVNQ,"Attn: Grace Moderate Incontinence Pads for Women, 28-Pack - High Absorbency, Breathable, Plant-Based - Incontinence Pads for Moderate Bladder Leaks & Sensitive Skin",$15.96,4K+ bought in past month,3.4K,4.2
122,B08JM9X93F,https://www.amazon.com/dp/B08JM9X93F,Veeda Natural Adult Incontinence Underwear for Women - Postpartum Underwear for Bladder Leakage Protection - Disposable Underwear with Maximum Absorbency - Large Size - 12 Count,$16.50,($1.38$1.38/count),446,4.0
123,B013AX7QJQ,https://www.amazon.com/dp/B013AX7QJQ,"Veeda Natural Cotton Ultra Thin Panty Liners for Women - Breathable Thin Daily Liners are Always Chlorine, and Toxin Free - Hypoallergenic & Comfortable Pantyliners - 40 Count",$9.49,300+ bought in past month,2.5K,4.1
124,B09B7QBVH2,https://www.amazon.com/dp/B09B7QBVH2,"Amazon Basics Regular Absorbency Pads for Women, Ultra Thin with Flexi-Wings, Unscented, Size 1, 36 Count, 1 Pack",$4.88,7K+ bought in past month,11.6K,4.5
125,B0BZFB8TQH,https://www.amazon.com/dp/B0BZFB8TQH,The Honey Pot Company - Herbal Panty Liners for Women - Heavy Flow w/Wings - Infused w/Essential Oils for Cooling Effect & Organic Cotton Cover - Feminine Care - 20 ct,$8.49,800+ bought in past month,3K,4.7
126,B09B7W9F9F,https://www.amazon.com/dp/B09B7W9F9F,"Amazon Basics Women's Incontinence Pads, Bladder Control & Postpartum, Light Absorbency, Unscented, 30 Count, (1 Pack of 30)",$6.45,10K+ bought in past month,23.3K,4.3
127,B016IS3536,https://www.amazon.com/dp/B016IS3536,"Always Discreet Adult Incontinence Pads for Women, Extra Heavy Absorbency, Long Length, Postpartum Pads, 45 Count",$22.97,10K+ bought in past month,12.4K,4.5
128,B00J4YWSEE,https://www.amazon.com/dp/B00J4YWSEE,"Always Ultra Thin Pads with Wings, Size 2, Long Super, 58 Count",$11.44,10K+ bought in past month,20.3K,4.7
129,B00G8DDCEE,https://www.amazon.com/dp/B00G8DDCEE,"Always Ultra Thin Pads with Wings, Size 2, Long Super, 42 Count",$8.94,8K+ bought in past month,3.6K,4.8
130,B000VI3LNE,https://www.amazon.com/dp/B000VI3LNE,"Natracare Cotton Natural Feminine Ultra Pads Regular With Wings By Natracare, 14 Ea, 14 Count",$10.85,1K+ bought in past month,667,4.5
131,B004VS50VG,https://www.amazon.com/dp/B004VS50VG,"Carefree Body Shape Thin Unscented, 60 Count (Pack of 2)",N/A,100+ bought in past month,2.4K,4.6
132,B0D1ZZBJ8D,https://www.amazon.com/dp/B0D1ZZBJ8D,"Organyc 100% Certified Organic Cotton 2 in 1 Panty Liners for Women Fits Thong or Regular Underwear, Light Flow, 20 Count",$7.49,500+ bought in past month,144,4.5
133,B003T0F8V4,https://www.amazon.com/dp/B003T0F8V4,Always Thin Pantiliners - scented - 20 pack (Case of 24),$36.82,100+ bought in past month,60,4.8
134,B082VYDVYV,https://www.amazon.com/dp/B082VYDVYV,"U by Kotex Balance Teen Ultra Thin Pads with Wings, Heavy Absorbency, 56 Count (4 Packs of 14) (Packaging May Vary)",$13.96,7K+ bought in past month,7.6K,4.7
135,B004DGMNJS,https://www.amazon.com/dp/B004DGMNJS,"Organyc 100% Certified Organic Cotton Flat Panty Liner - Everyday Sanitary Pad, Free from Wood Pulp, Perfumes, SAP and Chemicals - Light Flow+, 24 Count",$7.00,500+ bought in past month,2.2K,3.9
136,B0CPPMGL92,https://www.amazon.com/dp/B0CPPMGL92,"Ultra Thin Sanitary Pantyliners (Regular, 6.1 inch, 120 Counts) - Ultra Thin, Unscented 100% Organic Cotton Panty Liners for Women. Chemical-Free, Extra Soft, Ideal for Sensitive Skin",$19.90,($0.17$0.17/count),194,3.8
137,B004DGFFA2,https://www.amazon.com/dp/B004DGFFA2,"Organyc 100% Certified Organic Cotton Inside and Out Folded Panty Liner, Ultra Thin, Light Flow, 24 Count",$7.49,2K+ bought in past month,2.8K,4.0
138,B0BG3G11V2,https://www.amazon.com/dp/B0BG3G11V2,"Always Ultra Thin Overnight Pads with Wings, Size 4, Overnight, 96 Count (3 Packs of 32)",$21.96,6K+ bought in past month,1.7K,4.7
139,B07M7GVGJW,https://www.amazon.com/dp/B07M7GVGJW,"L. Chlorine Free Ultra Thin Liners Regular Absorbency, Organic Cotton, Free of Chlorine Bleaching, Pesticides, Fragrances, or Dyes, 100 Count",N/A,100+ bought in past month,668,4.6
140,B07NLXKYWN,https://www.amazon.com/dp/B07NLXKYWN,"Always Infinity Feminine Pads for Women, Flexfoam Pads with Wings, Size 5, Extra Heavy Overnight Absorbency, Unscented, 66 Count (3 Packs of 22)",$23.99,10K+ bought in past month,13.3K,4.7
141,B07B814P8F,https://www.amazon.com/dp/B07B814P8F,"Always Radiant Feminine Pads for Women, Flexfoam Pads with Wings, Size 1, Regular Absorbency, Lightly Scented, 42 Count",$11.47,4K+ bought in past month,1.4K,4.8
142,B08PCYTBW4,https://www.amazon.com/dp/B08PCYTBW4,"wegreeco Reusable Menstrual Pads - Reusable Sanitary Pads | Reusable Panty Liners | Soft Cloth Menstrual Pads - 6 Pack with 1 Cloth Mini Wet Bag (Small, Flower 02)",$12.99,($2.17$2.17/count),11.5K,4.3
143,B0DZ2DQZD4,https://www.amazon.com/dp/B0DZ2DQZD4,"PHOGARY 7 Packs Reusable Menstrual Pads with Wings for Women, Washable Overnight Cloth Panty Liners Sanitary Pads for Heavy Flow with Wet Bag",$15.99,($64.76$64.76/ounce),5,4.7
144,B09B84TZTW,https://www.amazon.com/dp/B09B84TZTW,"NutraBlast Balance Shield Panty Liners - Discharge & Odor-Proof Layers (180mm, 40-Pack)",$12.99,100+ bought in past month,355,4.1
145,B0DZ2FQK15,https://www.amazon.com/dp/B0DZ2FQK15,"PHOGARY 7 Packs Reusable Menstrual Pads with Wings, Breathable Mesh Surface Cloth Sanitary Pads for Heavy Flow with Wet Bag, Washable Overnight Cloth Panty Liners for Women",$15.99,($2.28$2.28/count),2,5.0
146,B07BQV78B3,https://www.amazon.com/dp/B07BQV78B3,"U by Kotex Clean & Secure Maxi Pads, Heavy Absorbency, 132 Count (3 Packs of 44) (Packaging May Vary)",$32.97,1K+ bought in past month,3.9K,4.5
147,B001LK6QJW,https://www.amazon.com/dp/B001LK6QJW,"Always Dailies Regular, Thin, Unscented Pantiliners, 60 Count - Pack of 2 (120 Total Count)",$16.05,100+ bought in past month,309,4.5
148,B09B7L2BPB,https://www.amazon.com/dp/B09B7L2BPB,"Amazon Basics Maxi Pads For Periods- Thick, Super Absorbency, Unscented, 48 Count, 1 Pack",$5.42,20K+ bought in past month,10.3K,4.4
149,B0BLGFR9H8,https://www.amazon.com/dp/B0BLGFR9H8,"U by Kotex Balance Ultra Thin Pads with Wings, Regular Absorbency, 50 Count (Packaging May Vary)",$6.49,10K+ bought in past month,5.9K,4.7
150,B0CNWNLSQ6,https://www.amazon.com/dp/B0CNWNLSQ6,"Oi | Organic Initiative Incontinence Liner, Organic Cotton Topsheet, Very Light Bladder Leakage, Breathable and Hypoallergenic, Very Light absorbs up to 1.7 floz (7.1"") 60 Liners",$20.99,100+ bought in past month,108,4.0
151,B0DQW8DT2D,https://www.amazon.com/dp/B0DQW8DT2D,"Reusable Menstrual Pads,Washable Sanitary Napkins with Wings for Women,Reusable Panty Liners,Soft Cloth Menstrual Pads,7pcs/Set,Pack of 6+1 Storage Bag,Suitable for Menstrual Period",$24.99,($24.99$24.99/count),4,5.0
152,B0CWDWKYNW,https://www.amazon.com/dp/B0CWDWKYNW,"uNeat Panty Liners for Women & Teens, Pantiliners with Wings, Mini Sanitary Pads, Light Periods and Leaks, Ultra Thin Daily Liners for Women,30 Count",$5.99,200+ bought in past month,165,4.3
153,B0B3R365YL,https://www.amazon.com/dp/B0B3R365YL,"Pinkie Period Starter Pads - Designed for Smaller Underwear - Organic Cotton Topsheet Tween & Teen Pads with Wings - Chlorine Free & Fragrance Free - Teen Mini, 18 Count",$8.98,4K+ bought in past month,2K,4.7
154,B004VS51CY,https://www.amazon.com/dp/B004VS51CY,"Carefree Body Shape Extra Long Unscented, 36-count (Pack of 2)",$17.00,50+ bought in past month,208,4.6
155,B0169T59FG,https://www.amazon.com/dp/B0169T59FG,Natracare Natural Curved Panty Liners - 30 Pack - Organic Cotton Cover - Chlorine Free,$9.36,($0.31$0.31/count),24,3.2
156,B0BSR94ZQ5,https://www.amazon.com/dp/B0BSR94ZQ5,"Always Radiant Teen Pads, Size 1, Regular, with Wings, Unscented, 42 Count",$11.47,10K+ bought in past month,7.9K,4.8
157,B084S1JLX1,https://www.amazon.com/dp/B084S1JLX1,"Always Pure Cotton Feminine Pads for Women, FlexFoam Pads with Wings, Size 1, Regular Absorbency, Unscented, 84 Count (3 Packs of 28)",$26.91,4K+ bought in past month,2.4K,4.7
158,B001DWNTBG,https://www.amazon.com/dp/B001DWNTBG,"Always Maxi Feminine Pads Without Wings for Women, Size 1, Regular Absorbency, Unscented 48 Count",$6.27,10K+ bought in past month,4.6K,4.5
159,B01HODORIQ,https://www.amazon.com/dp/B01HODORIQ,"Always Radiant Feminine Pads for Women, Flexfoam Pads with Wings, Size 2, Heavy Absorbency, Lightly Scented, 78 Count (3 Packs of 26)",$23.91,7K+ bought in past month,10.7K,4.8
160,B08CM45JDR,https://www.amazon.com/dp/B08CM45JDR,"Organyc 100% Organic Cotton Inside and Out Light Incontinence Liners for Bladder Leakage Control, FSA/HSA Eligible, Ultra Thin, Light Flow, 24 Count",$7.89,300+ bought in past month,357,3.8
161,B01IZ5EHJG,https://www.amazon.com/dp/B01IZ5EHJG,"Always Ultra Thin Overnight Pads with Wings, Size 4, Overnight, 78 Count (3 Packs of 26)",$18.39,9K+ bought in past month,20.3K,4.7
162,B00J7L59K4,https://www.amazon.com/dp/B00J7L59K4,"Always Infinity Feminine Pads for Women, Flexfoam Pads with Wings, Size 2, Heavy Absorbency, Unscented, 46 Count",$11.47,20K+ bought in past month,11.7K,4.8
163,B01IQXXUFO,https://www.amazon.com/dp/B01IQXXUFO,"Always Radiant Feminine Pads for Women, Flexfoam Pads with Wings, Size 4, Overnight Absorbency, Lightly Scented, 60 Count (3 Packs of 20)",$24.49,6K+ bought in past month,10.2K,4.8
164,B0BLGS63VD,https://www.amazon.com/dp/B0BLGS63VD,"U by Kotex Balance Ultra Thin Pads with Wings, Overnight Absorbency, 38 Count",$9.97,7K+ bought in past month,4.8K,4.7
165,B07NLSLP9K,https://www.amazon.com/dp/B07NLSLP9K,"Always Radiant Feminine Pads for Women, Flexfoam Pads with Wings, Size 5, Extra Heavy Overnight Absorbency, Lightly Scented, 54 Count (3 Packs of 18)",$22.99,10K+ bought in past month,9.5K,4.7
166,B00TO70LGS,https://www.amazon.com/dp/B00TO70LGS,"U by Kotex Lightdays Panty Liners, Regular, 129 Count",N/A,No featured offers available,1.7K,4.3
167,B00NAZ32P2,https://www.amazon.com/dp/B00NAZ32P2,"Poise Incontinence Panty Liners, Very Light Absorbency, Regular Length (26 Count)",$10.00,($0.38$0.38/count),1.5K,4.7
168,B00D4XQM3O,https://www.amazon.com/dp/B00D4XQM3O,Kotex Security Ultra Thin Pads Long 20 Each,$8.81,500+ bought in past month,327,4.6
169,B0054BMRS8,https://www.amazon.com/dp/B0054BMRS8,"Carefree Body Shape Long To-Go Pantiliners, Unscented - 42 ct",N/A,100+ bought in past month,156,4.5
170,B00VIP6IQG,https://www.amazon.com/dp/B00VIP6IQG,"Organic & Natural Panty Liners,Normal Natracare 18 Liners Box",$7.83,50+ bought in past month,74,3.8
171,B0C4Z4VBSK,https://www.amazon.com/dp/B0C4Z4VBSK,"Inertia PureComfort Organic Panty Liners: Ultra-Soft, Chemical-Free Protection for Everyday Comfort (Pack of 1)",$6.79,100+ bought in past month,55,4.3
172,B0006GQ4T4,https://www.amazon.com/dp/B0006GQ4T4,"Always Liner, Regular, 0.2 lb, Lavender",N/A,300+ bought in past month,677,4.5
173,B084RZTTVW,https://www.amazon.com/dp/B084RZTTVW,"Always Pure Cotton Feminine Pads for Women, FlexFoam Pads with Wings, Size 2, Heavy Absorbency, Unscented, 72 Count (3 Packs of 24)",$26.91,7K+ bought in past month,3.1K,4.8
174,B0CP8NPP61,https://www.amazon.com/dp/B0CP8NPP61,"Always Pocket Flexfoam Pads, Size 2, Heavy, with Wings, 20 Count",$8.88,8K+ bought in past month,991,4.6
175,B01MSZJW51,https://www.amazon.com/dp/B01MSZJW51,"Always Infinity Feminine Pads for Women, Flexfoam Pads with Wings, Size 3, Extra Heavy Absorbency, Unscented, 84 Count (3 Packs of 28)",$26.91,8K+ bought in past month,8.6K,4.7
176,B0BJPCBC7X,https://www.amazon.com/dp/B0BJPCBC7X,"Saba Diarios Multishape Pantiliners, Ultra Thin & Discreet Panty Liners for Women, Designed for All Body Types, 240 Count (8 Packs of 30)",$12.99,50+ bought in past month,80,4.3
177,B0D14W4NYC,https://www.amazon.com/dp/B0D14W4NYC,"U by Kotex Clean & Secure Panty Liners, Light Absorbency, Extra Coverage, 112 Count (Packaging May Vary) (Pack of 2)",$16.74,($0.07$0.07/count),30,4.6
178,B00NAZ4QUM,https://www.amazon.com/dp/B00NAZ4QUM,"U by Kotex Barely There Liners, Light Absorbency, Unscented",$6.49,700+ bought in past month,694,4.6
179,B01AC9JV0I,https://www.amazon.com/dp/B01AC9JV0I,"Carefree Extra Long Panty Liners, Unscented, Multi-Fluid Protection, 36 Count (Pack of 5)",$25.98,200+ bought in past month,70,4.8
180,B08R3WLHDD,https://www.amazon.com/dp/B08R3WLHDD,"SUNKISS TrustPlus Unisex Incontinence Disposable Underwear, Heavy Absorbency, Barrier Leak Protection, Odor Control, 16 Count, Small/Medium",$19.98,($1.25$1.25/count),3.5K,4.1
181,B004DGH596,https://www.amazon.com/dp/B004DGH596,"Organyc - 100% Certified Organic Cotton Feminine Pads - Heavy Flow, 10 Count (Pack of 1) (B003ART1JG)",$7.63,800+ bought in past month,1.7K,4.3
182,B0F1TKB6YQ,https://www.amazon.com/dp/B0F1TKB6YQ,"MODAL Panty Liners for Women, Unscented Sanitary Pads with Wings, Daily Thin Panty Liners, 7.5 Inch(190 mm), Mini, 20 Count",$9.99,($0.50$0.50/count),75,4.4
183,B01FSKRBJE,https://www.amazon.com/dp/B01FSKRBJE,"Medline ContourPlus Bladder Control Pads, Maximum Absorbency, 6.5 x 13.5 Inches, Bag of 28",$16.31,300+ bought in past month,2.5K,4.2
184,B01AC9JV0I,https://www.amazon.com/dp/B01AC9JV0I,"Carefree Extra Long Panty Liners, Unscented, Multi-Fluid Protection, 36 Count (Pack of 5)",$25.98,200+ bought in past month,70,4.8
185,B074JCBQWB,https://www.amazon.com/dp/B074JCBQWB,"Always Ultra Thin Long Super Pads, 20 Count, (Pack of 2)",$18.98,100+ bought in past month,351,4.2
186,B078G2QT1D,https://www.amazon.com/dp/B078G2QT1D,Natracare Panty Liners Mini 30 Count (6 Pack),$32.99,100+ bought in past month,100,4.7
187,B08ZMSXLPN,https://www.amazon.com/dp/B08ZMSXLPN,"Eco by Naty Panty Liners for Women – Liners for Daily use, Eco-Friendly Women’s Thin Discreet Panty Liners with Organic Cotton to Keep You Fresh (32 Count)",$4.89,50+ bought in past month,910,3.9
188,B074J5L7RL,https://www.amazon.com/dp/B074J5L7RL,"365 by Whole Foods Market, Ultra Thin Pads with Wings, Regular Absorbency, Made with Organic Cotton, 10 Count",$6.79,300+ bought in past month,100,4.4
189,B0175Y2SRQ,https://www.amazon.com/dp/B0175Y2SRQ,"U by Kotex Absorbent Pantiliners, Long, Individually Wrapped, Unscented, New Value Pack Size 16 Count (Pack of 12)",N/A,No featured offers available,77,4.8
190,B00SX07AH0,https://www.amazon.com/dp/B00SX07AH0,"Carefree Original Regular Fresh Scent - 20 Liners, Pack of 4",N/A,100+ bought in past month,80,4.5
191,B01IULAZ5K,https://www.amazon.com/dp/B01IULAZ5K,"Always Infinity Feminine Pads for Women, Flexfoam Pads without Wings, Size 2, Heavy Absorbency, Unscented, 96 Count (3 Packs of 32)",$26.82,2K+ bought in past month,2.9K,4.7
192,B074J7QFWP,https://www.amazon.com/dp/B074J7QFWP,"365 by Whole Foods Market, Ultra Thin Pads, Made with Organic Cotton Pads, Super, 10 ct",$7.99,300+ bought in past month,156,4.3
193,B0D92R4SF3,https://www.amazon.com/dp/B0D92R4SF3,Saba V-Confident Long Liner 800 ct (20 Packs of 40 ct),N/A,No featured offers available,N/A,N/A
194,B084ZR9JTH,https://www.amazon.com/dp/B084ZR9JTH,"Always Radiant Daily Liners Light Absorbency, Long Length, Up to 100% Odor Free and Fragrance Free, with Edge-2-Edge Adhesive, 92 ( individually wrapped )",N/A,50+ bought in past month,1.8K,4.5
195,B0D14W87NR,https://www.amazon.com/dp/B0D14W87NR,"Poise Daily Incontinence Panty Liners, 2 Drop Very Light Absorbency, Regular, 48 Count of Pantiliners, Packaging May Vary (Pack of 2)",$12.82,($0.13$0.13/count),289,4.8
196,B0D15DHQ24,https://www.amazon.com/dp/B0D15DHQ24,"U by Kotex Clean & Secure Panty Liners, Light Absorbency, Long Length, 126 Count (Packaging May Vary) (Pack of 2)",$15.58,($0.06$0.06/count),28,4.8
197,B0FHWTGF3P,https://www.amazon.com/dp/B0FHWTGF3P,"Pixie Organic Cotton Panty Liners for Women - Regular Wrapped Pantiliners - Light Absorbency & Ultra-Thin - Leak-Proof, Hypoallergenic & Unscented - Compostable - 44 Count",$8.95,100+ bought in past month,42,4.3
198,B08SGK7P2F,https://www.amazon.com/dp/B08SGK7P2F,"U by Kotex Clean & Secure Overnight Maxi Pads with Wings, Extra Heavy Absorbency, 48 Count (2 Packs of 24) (Packaging May Vary)",$21.98,1K+ bought in past month,3.8K,4.6
199,B0F1TMWP1J,https://www.amazon.com/dp/B0F1TMWP1J,"BST Panty Liners for Women, Daily Thin Panty Liners with Wings, Herbal Sanitary Pads with Camellia and Mint Scent, 7.5 Inch(190 mm), Mini, 10 Count",$4.99,($0.50$0.50/count),61,4.3
200,B08PCYTBW4,https://www.amazon.com/dp/B08PCYTBW4,"wegreeco Reusable Menstrual Pads - Reusable Sanitary Pads | Reusable Panty Liners | Soft Cloth Menstrual Pads - 6 Pack with 1 Cloth Mini Wet Bag (Small, Flower 02)",$12.99,($2.17$2.17/count),11.5K,4.3
201,B013AX7QJQ,https://www.amazon.com/dp/B013AX7QJQ,"Veeda Natural Cotton Ultra Thin Panty Liners for Women - Breathable Thin Daily Liners are Always Chlorine, and Toxin Free - Hypoallergenic & Comfortable Pantyliners - 40 Count",$9.49,300+ bought in past month,2.5K,4.1
202,B0FHWSZPYT,https://www.amazon.com/dp/B0FHWSZPYT,"Pixie Organic Cotton Panty Liners for Women - Long Wrapped Pantiliners - Light Absorbency & Ultra-Thin - Leak-Proof, Hypoallergenic & Unscented - Compostable - 44 Count",$9.95,100+ bought in past month,42,4.3
203,B0CPPMGL92,https://www.amazon.com/dp/B0CPPMGL92,"Ultra Thin Sanitary Pantyliners (Regular, 6.1 inch, 120 Counts) - Ultra Thin, Unscented 100% Organic Cotton Panty Liners for Women. Chemical-Free, Extra Soft, Ideal for Sensitive Skin",$19.90,($0.17$0.17/count),194,3.8
204,B018E6TTAI,https://www.amazon.com/dp/B018E6TTAI,"Carefree Acti-Fresh Body Shaped Panty Liners, Flexible Protection that Molds to Your Body, Long, 112 Count (Pack of 1)",$29.66,100+ bought in past month,10.2K,4.7
205,B0C4NQH7R3,https://www.amazon.com/dp/B0C4NQH7R3,"Ultra Thin Sanitary Pantyliners (Regular, 6.1 inch, 40 Counts) - Ultra Thin, Unscented 100% Organic Cotton Panty Liners for Women. Chemical-Free, Extra Soft, Ideal for Sensitive Skin",$8.99,100+ bought in past month,194,3.8
206,B004VLUIII,https://www.amazon.com/dp/B004VLUIII,Carefree Acti-Fresh Body Shape Thin Unscented Pantiliners - 60 Ct,$9.89,($0.16$0.16/count),1,2.0
207,B09B7PPZG9,https://www.amazon.com/dp/B09B7PPZG9,"Amazon Basics Thick Maxi Pads with Flexi-Wings for Periods, Long Length, Super Absorbency, Unscented, Size 2, 32 Count, 1 Pack (Previously Solimo)",$5.68,3K+ bought in past month,13K,4.4
208,B0DQW8DT2D,https://www.amazon.com/dp/B0DQW8DT2D,"Reusable Menstrual Pads,Washable Sanitary Napkins with Wings for Women,Reusable Panty Liners,Soft Cloth Menstrual Pads,7pcs/Set,Pack of 6+1 Storage Bag,Suitable for Menstrual Period",$24.99,($24.99$24.99/count),4,5.0
209,B09B84TZTW,https://www.amazon.com/dp/B09B84TZTW,"NutraBlast Balance Shield Panty Liners - Discharge & Odor-Proof Layers (180mm, 40-Pack)",$12.99,100+ bought in past month,355,4.1
210,B0FG2HF6KY,https://www.amazon.com/dp/B0FG2HF6KY,"Le Ciel Organic Cotton Panty Liners – Long Length, Breathable and Soft Cover (18 Count)",$14.90,($0.83$0.83/count),N/A,N/A
211,B0DFZTY7F8,https://www.amazon.com/dp/B0DFZTY7F8,"LOLA Panty Liners - 56 Count - Cotton Top Sheet & Core, Breathable Daily Liners for Women - Hypoallergenic Unscented Organic Pads for Women",$18.97,2K+ bought in past month,409,4.2
212,B0CXF7S9SD,https://www.amazon.com/dp/B0CXF7S9SD,"Carefree Panty Liners, Extra Long & Long, Unscented, 192ct (Packaging May Vary)",$13.56,List: ,7,5.0
213,B0F1TMC7D3,https://www.amazon.com/dp/B0F1TMC7D3,"MODAL Panty Liners for Women, Unscented Sanitary Pads with Wings, Daily Thin Panty Liners, 7.5 Inch(190 mm), Mini, 10 Count",$5.99,($0.60$0.60/count),75,4.4
214,B012P5FW8C,https://www.amazon.com/dp/B012P5FW8C,"Always Radiant Daily Feminine Panty Liners For Women, Regular Absorbency, Unscented, 96 Count(Pack of 1)",N/A,No featured offers available,2.4K,4.7
215,B01HHCEXLA,https://www.amazon.com/dp/B01HHCEXLA,"Rael Reusable Panty Liners Menstrual, Organic Cotton Cover, Period Essential, Cloth Pantyliner for Women, Washable, Soft and Thin, Leak-Free, Washing Machine Safe (5 Count, Brown)",$39.99,100+ bought in past month,1.4K,4.3
216,B0CDQ49C53,https://www.amazon.com/dp/B0CDQ49C53,"U by Kotex, Balance Heavy Ultra Thin Pads + Wings, 16 Count",$9.80,50+ bought in past month,16,4.4
217,B0CJCH9W4M,https://www.amazon.com/dp/B0CJCH9W4M,Feel Normal Disposable Black Panty Liners for Women 36 pcs with Protective Layer for Extra Protection Against Leaks,$15.10,100+ bought in past month,65,4.2
218,B098F8KB81,https://www.amazon.com/dp/B098F8KB81,The Honey Pot Company - Herbal Panty Liners for Women - Organic Incontinence w/Wings - Infused w/Essential Oils for Cooling Effect - Postpartum Essentials - Feminine Care - 20ct,$9.49,400+ bought in past month,513,4.6
219,B0CZ7FVDQ4,https://www.amazon.com/dp/B0CZ7FVDQ4,"Flex Bamboo Panty Liners | Ultra Thin Daily Pantyliners | Comfortable Fragrance-Free Feminine Care Liners | 100% Bamboo | 7.08” Long, 10mL Absorbency | Helps Fight Odor | (2-Pack, 100 Liners Total)",$15.99,50+ bought in past month,78,3.8
220,B0054BMMVK,https://www.amazon.com/dp/B0054BMMVK,"CAREFREE Original Regular to Go Pantiliners, Unscented 54 ea, Pink",$30.99,50+ bought in past month,249,4.4
221,B082JFD12P,https://www.amazon.com/dp/B082JFD12P,"Always Discreet Boutique Incontinence Pads, for Bladder Leaks, Moderate Absorbency, Regular Length, 144 Count (3 Packs of 48)",$41.64,2K+ bought in past month,2.8K,4.6
222,B002OTJSPI,https://www.amazon.com/dp/B002OTJSPI,"Always Thin Mince, Wrapped, 60 Count",$17.50,300+ bought in past month,2.7K,4.6
223,B00OW7KZT8,https://www.amazon.com/dp/B00OW7KZT8,Always Thin Active,N/A,No featured offers available,218,4.1
224,B00IT4COVC,https://www.amazon.com/dp/B00IT4COVC,"Kotex Lightdays Liner, Long, 16 Count, (Pack of 6)",$17.49,100+ bought in past month,369,4.7
225,B08RJFFGZT,https://www.amazon.com/dp/B08RJFFGZT,"Poise Ultra Thin Incontinence Pads & Postpartum Pads for Bladder Leaks, 4 Drop Moderate Absorbency, Long Length, 48 Count, Packaging May Vary",$15.29,2K+ bought in past month,13.9K,4.6
226,B001E11PYE,https://www.amazon.com/dp/B001E11PYE,"NATRACARE PANTY LINER,TANGA, 30 CT",$8.70,100+ bought in past month,10,4.1
227,B08HRRTCZF,https://www.amazon.com/dp/B08HRRTCZF,"Made in EU - Ultra-Thin Reusable Panty Liners (Medium, 7-Pack) – High-Temp Washable Cloth Panty Liners for Women – Durable & Breathable Organic Cotton Keeps You Fresh & Dry for Daily Vaginal Discharge",$57.97,($8.28$8.28/count),4.5K,4.2
228,B018JQKM9A,https://www.amazon.com/dp/B018JQKM9A,"U by Kotex Barely There Liners, Light Absorbency, Unscented",$13.99,($0.78$0.78/count),768,4.7
229,B0DK7TGW38,https://www.amazon.com/dp/B0DK7TGW38,"Poise Daily Thong Liners, Incontinence Panty Liners for Bladder Leaks, 1 Drop Lightest Absorbency, 50 Count of Pantiliners",N/A,1K+ bought in past month,83,4.4
230,B07BQV8NLJ,https://www.amazon.com/dp/B07BQV8NLJ,"Poise Daily Microliners, Incontinence Panty Liners, Lightest Absorbency, Long, 50 Count",$11.88,100+ bought in past month,2.8K,4.6
231,B0D14VZ61N,https://www.amazon.com/dp/B0D14VZ61N,"U by Kotex Balance Wrapped Panty Liners, Regular Length, 80 Count (Packaging May Vary) (Pack of 2)",$7.00,($0.04$0.04/count),28,4.6
232,B008UR8LBA,https://www.amazon.com/dp/B008UR8LBA,"Carefree Body Shape Pantiliners, Extra Long To Go Unscented, 36 ct",$3.58,100+ bought in past month,639,4.6
233,B093WP1C1H,https://www.amazon.com/dp/B093WP1C1H,"Amazon Basics Ultra Thin Pads with Flexi-Wings for Periods, Extra Long Length, Super Absorbency, Unscented, Size 3, 28 Count, 1 Pack (Previously Solimo)",$4.60,5K+ bought in past month,2.2K,4.5
234,B076HC781C,https://www.amazon.com/dp/B076HC781C,"Oi l Organic Initiative - Ultra-Thin Pantyliner, 100% Certified Organic Cotton | Biodegradable, Free from Chlorine Bleaching, Pesticides, Toxic Chemicals | 80 Liners",$20.99,100+ bought in past month,225,4.0
235,B00NNZSOGG,https://www.amazon.com/dp/B00NNZSOGG,"Organyc 100% Certified Organic Cotton Everyday Panty Liner, Folded, Light Flow, 24 Count, 1-Pack",$12.76,($0.53$0.53/count),260,4.2
236,B0F2P41N8N,https://www.amazon.com/dp/B0F2P41N8N,Veeda Natural Premium Ultra Thin Panty Liners for Women - Breathable Thin Daily Liners are Always Chlorine and Toxin Free - Hypoallergenic Pantiliners - Petite Lite Absorbency - 92 Count,$14.77,50+ bought in past month,646,3.8
237,B01GTGZXVE,https://www.amazon.com/dp/B01GTGZXVE,"U by Kotex Curves Panty Liners, Regular, 80 Count (Pack of 6)",$23.17,($0.05$0.05/count),7,2.2
238,B07FDG7TLK,https://www.amazon.com/dp/B07FDG7TLK,PEESAFE Panty Liners for Women Daily Use with Aloe Vera (Pack of 50 Liners)| Curvy Design for Extra Comfort | Cottony-Soft Surface with 185mm Wide | Keeps You Dry & Fresh All Day Long,$9.99,($0.20$0.20/count),11.5K,4.3
239,B0D5ZPP9K1,https://www.amazon.com/dp/B0D5ZPP9K1,Micro Pantyliners,$9.99,50+ bought in past month,31,4.1
240,B0CFG8VD9W,https://www.amazon.com/dp/B0CFG8VD9W,"Livlit Regular Size Ultra Thin Sanitary Pads, 100% Organic Cotton from Texas, Powerful Leak Protection, Unscented, Chlorine Free and Absorbency of Feminine Periods, Pads for Women (14 Count)",$9.99,100+ bought in past month,1.8K,3.9
241,B013DQOFOY,https://www.amazon.com/dp/B013DQOFOY,Veeda Natural Cotton Night Pads for Women - Overnight Heavy Flow Absorbent Ultra-Thin Feminine Pad - Hypoallergenic Period pads with Wings - Unscented & Chlorine free Sanitary Napkins - 12 Count,$5.85,100+ bought in past month,857,4.4
242,B08R3WLHDD,https://www.amazon.com/dp/B08R3WLHDD,"SUNKISS TrustPlus Unisex Incontinence Disposable Underwear, Heavy Absorbency, Barrier Leak Protection, Odor Control, 16 Count, Small/Medium",$19.98,($1.25$1.25/count),3.5K,4.1
243,B0BLGRQHCQ,https://www.amazon.com/dp/B0BLGRQHCQ,"Poise Incontinence & Postpartum Pads for Bladder Leaks, 7 Drop Ultra Absorbency, Long Length, 78 Count, Packaging May Vary",$42.96,10K+ bought in past month,3K,4.6
244,B073V2VLLK,https://www.amazon.com/dp/B073V2VLLK,Carefree Acti-Fresh Regular 54 Ct. Unscented 2pk,$14.69,100+ bought in past month,101,4.7
