,asin,product_url,title,price,bought,review_count,rating
0,B09B7L2BLJ,https://www.amazon.com/dp/B09B7L2BLJ,"Amazon Basics Daily Pantiliner, Regular Length, Pads for Women, Unscented, 50 Count (Previously Solimo)",$3.38,10K+ bought in past month,15.1K,4.2
1,B013AX7QJQ,https://www.amazon.com/dp/B013AX7QJQ,"Veeda Natural Cotton Ultra Thin Panty Liners for Women - Breathable Thin Daily Liners are Always Chlorine, and Toxin Free - Hypoallergenic & Comfortable Pantyliners - 40 Count",$9.49,300+ bought in past month,2.5K,4.1
2,B09FD1B6JD,https://www.amazon.com/dp/B09FD1B6JD,"SANDIS Premium 100% Organic Panty Liners - Chemical Free Cotton Ultra Thin Liner for Women | Feminine Sanitary Napkins Unscented Everyday Use Leak Protection (Regular, 36 Count, Wrapped)",$8.99,2K+ bought in past month,599,4.2
3,B0F1TMC7D3,https://www.amazon.com/dp/B0F1TMC7D3,"MODAL Panty Liners for Women, Unscented Sanitary Pads with Wings, Daily Thin Panty Liners, 7.5 Inch(190 mm), Mini, 10 Count",$5.99,($0.60$0.60/count),75,4.4
4,B00NJNJ6O6,https://www.amazon.com/dp/B00NJNJ6O6,"Carefree Panty Liners for Women, Regular, Unwrapped, Unscented, 120ct | Pantiliners, Carefree Liners, Daily Liners for Women, Light Periods and Leaks, 8-Hour Odor Control | 120ct (Packaging May Vary)",$6.27,20K+ bought in past month,29.8K,4.7
5,B003VD5TMM,https://www.amazon.com/dp/B003VD5TMM,"Always Daily Fresh Thin Liners, Regular Absorbency, Unscented Panty Liners, 162 Count",$8.99,40K+ bought in past month,38.5K,4.6
6,B0FSHPJH79,https://www.amazon.com/dp/B0FSHPJH79,Equate Overnight Ultra Thin Pads Liners Size 4 with Flexi-Wings - Pack of 37 (Total of 74) and Vital Volumes Tips Card Bundle,$24.95,New on Amazon in past month,N/A,N/A
7,B00UASJJX6,https://www.amazon.com/dp/B00UASJJX6,"U by Kotex Balance Wrapped Panty Liners, Regular Length, 80 Count (Packaging May Vary)",$3.50,20K+ bought in past month,32.6K,4.6
8,B09B7L2BLJ,https://www.amazon.com/dp/B09B7L2BLJ,"Amazon Basics Daily Pantiliner, Regular Length, Pads for Women, Unscented, 50 Count (Previously Solimo)",$3.38,10K+ bought in past month,15.1K,4.2
9,B01ARVVTYW,https://www.amazon.com/dp/B01ARVVTYW,"Carefree Panty Liners for Women, Regular, Wrapped, Unscented, 54ct | Pantiliners, Carefree Liners, Daily Liners for Women, Light Periods and Leaks, 8-Hour Odor Control | 54ct (Packaging May Vary)",$3.34,30K+ bought in past month,9.8K,4.6
10,B09B7QBVH2,https://www.amazon.com/dp/B09B7QBVH2,"Amazon Basics Regular Absorbency Pads for Women, Ultra Thin with Flexi-Wings, Unscented, Size 1, 36 Count, 1 Pack",$4.88,7K+ bought in past month,11.6K,4.5
11,B07C99C39S,https://www.amazon.com/dp/B07C99C39S,"U by Kotex Panty Liners, Clean & Secure, Light Absorbency, Long Length, 126 Count (Packaging May Vary)",$7.79,10K+ bought in past month,23.2K,4.4
12,B07258JQ9M,https://www.amazon.com/dp/B07258JQ9M,"Rael Panty Liners for Women, Organic Cotton Cover - Regular Pantiliners, Light Absorbency, Unscented, Chlorine Free (Regular, 44 Count)",$8.99,10K+ bought in past month,23.7K,4.1
13,B0DR3579J9,https://www.amazon.com/dp/B0DR3579J9,"Always Daily Protect Liners, Regular Length, Unscented, 96 Count",$7.17,9K+ bought in past month,739,4.6
14,B09VMHGQFG,https://www.amazon.com/dp/B09VMHGQFG,"Carefree Panty Liners for Women, Extra Long, Unwrapped, Unscented, 100ct | Pantiliners, Carefree, Daily for Women, Light Periods and Leaks, 8-Hour Odor Control|100ct (Packaging May Vary)",$6.78,20K+ bought in past month,8.8K,4.7
15,B0CPPMGL92,https://www.amazon.com/dp/B0CPPMGL92,"Ultra Thin Sanitary Pantyliners (Regular, 6.1 inch, 120 Counts) - Ultra Thin, Unscented 100% Organic Cotton Panty Liners for Women. Chemical-Free, Extra Soft, Ideal for Sensitive Skin",$19.90,($0.17$0.17/count),194,3.8
16,B0CNWNLSQ6,https://www.amazon.com/dp/B0CNWNLSQ6,"Oi | Organic Initiative Incontinence Liner, Organic Cotton Topsheet, Very Light Bladder Leakage, Breathable and Hypoallergenic, Very Light absorbs up to 1.7 floz (7.1"") 60 Liners",$20.99,100+ bought in past month,108,4.0
17,B004DGFFA2,https://www.amazon.com/dp/B004DGFFA2,"Organyc 100% Certified Organic Cotton Inside and Out Folded Panty Liner, Ultra Thin, Light Flow, 24 Count",$7.49,2K+ bought in past month,2.8K,4.0
18,B0FHWX7T63,https://www.amazon.com/dp/B0FHWX7T63,"Pixie Organic Cotton Panty Liners for Women - Long Wrapped Pantiliners - Light Absorbency & Ultra-Thin - Leak-Proof, Hypoallergenic & Unscented - Compostable - 88 Count",$16.95,50+ bought in past month,42,4.3
19,B008HQ8M6I,https://www.amazon.com/dp/B008HQ8M6I,"Always Daily Extra Protect Liners, Long Length, Unscented Panty Liners, 108 Count",$9.42,20K+ bought in past month,25.6K,4.6
20,B0DXM5CP2B,https://www.amazon.com/dp/B0DXM5CP2B,"L. Ultra Thin Liners for Women, Regular Coverage, Organic Cotton Top Layer, Unscented Pantiliners, 100 Count",$8.97,10K+ bought in past month,591,4.5
21,B01KNR5FNG,https://www.amazon.com/dp/B01KNR5FNG,"Always Daily Extra Protect Liners, Extra Long Length, Scented Panty Liners, 60 Count",$6.97,10K+ bought in past month,26.1K,4.6
22,B004RSO890,https://www.amazon.com/dp/B004RSO890,Carefree Thong Regular 49 Count Unscented Liner,$3.58,10K+ bought in past month,9.5K,4.8
23,B0949JRVNQ,https://www.amazon.com/dp/B0949JRVNQ,"Attn: Grace Moderate Incontinence Pads for Women, 28-Pack - High Absorbency, Breathable, Plant-Based - Incontinence Pads for Moderate Bladder Leaks & Sensitive Skin",$15.96,4K+ bought in past month,3.4K,4.2
24,B0D1ZZBJ8D,https://www.amazon.com/dp/B0D1ZZBJ8D,"Organyc 100% Certified Organic Cotton 2 in 1 Panty Liners for Women Fits Thong or Regular Underwear, Light Flow, 20 Count",$7.49,500+ bought in past month,144,4.5
25,B074QJJ6RZ,https://www.amazon.com/dp/B074QJJ6RZ,Pixie Cotton Cloth Pads - 100% Organic Reusable Cotton -Ranked 1 for Softest Menstrual Sanitary Napkins - Machine Washable & Includes Free Wet Bag - Menstrual Liner (Regular),$34.95,500+ bought in past month,381,4.4
26,B00IPBWWZW,https://www.amazon.com/dp/B00IPBWWZW,"U by Kotex Balance Daily Panty Liners for Thongs, Wrapped, Light Absorbency, Regular Length, 50 Count (Packaging May Vary)",$3.89,10K+ bought in past month,2.5K,4.6
27,B014TIO4XM,https://www.amazon.com/dp/B014TIO4XM,"Always Radiant Pantiliners, Regular, Unscented, 48 Liners (Pack of 2)",$16.85,3K+ bought in past month,1K,4.7
28,B0752S8Z7G,https://www.amazon.com/dp/B0752S8Z7G,"U by Kotex Barely There Thin Lines - 50 ct, Pack of 3",$19.91,600+ bought in past month,247,4.8
29,B007QVLWS0,https://www.amazon.com/dp/B007QVLWS0,"Poise Daily Liners, Incontinence Panty Liners for Bladder Leaks, 2 Drop Very Light Absorbency, Regular Length, 48 Count of Pantiliners, Packaging May Vary",$6.41,10K+ bought in past month,4.1K,4.7
30,B0CKTY3Q5B,https://www.amazon.com/dp/B0CKTY3Q5B,"Poise Daily Microliners, Incontinence Panty Liners for Bladder Leaks, 1 Drop Lightest Absorbency, Long Length, 50 Count of Pantiliners",$6.79,8K+ bought in past month,1.4K,4.6
31,B07YQ8RH6Q,https://www.amazon.com/dp/B07YQ8RH6Q,"Cora Period Regular Liners | 100% Organic Cotton Topsheet | Ultra Thin, Quick Absorbency | Hypoallergenic | Dermatologically Tested | Unscented, No Wings (42 Liners)",$11.49,4K+ bought in past month,4K,4.5
32,B082JG2QJL,https://www.amazon.com/dp/B082JG2QJL,"Always Discreet Boutique Incontinence Panty Liners for Bladder Leaks, Size 2, Very Light Absorbency, Long Length, 96 Count (3 Packs of 32)",$16.99,4K+ bought in past month,2.6K,4.6
33,B0787C4NWF,https://www.amazon.com/dp/B0787C4NWF,The Honey Pot Company - Herbal Everyday Panty Liners for Women - Infused w/Essential Oils for Cooling Effect & Organic Cotton Cover - Feminine Care - 30 ct,$7.97,10K+ bought in past month,12.7K,4.6
34,B096VXFP42,https://www.amazon.com/dp/B096VXFP42,The Honey Pot Company - Non-Herbal Everyday Panty Liners for Women - Organic Cotton Cover & Ultra-Absorbent Pulp Core - Sanitary Pads - Feminine Care - 30 ct,$7.97,8K+ bought in past month,2.1K,4.6
35,B00028PSC0,https://www.amazon.com/dp/B00028PSC0,"NATRACARE Mini Pant Liners, Unscented, (Pack of 30)",$4.78,2K+ bought in past month,4K,4.1
36,B09LKLNHSG,https://www.amazon.com/dp/B09LKLNHSG,"Carefree Body Shape Pant Liners, Regular, Multicolor Unscented 54 Count (Pack of 2)",$6.68,($0.06$0.06/count),1.7K,4.8
37,B004DGFFA2,https://www.amazon.com/dp/B004DGFFA2,"Organyc 100% Certified Organic Cotton Inside and Out Folded Panty Liner, Ultra Thin, Light Flow, 24 Count",$7.49,2K+ bought in past month,2.8K,4.0
38,B086L35YNS,https://www.amazon.com/dp/B086L35YNS,"Claene Organic Cotton Panty Liners, Unscented,Thin, Daily, Breathable, Light Incontinence, Natural Pantyliners, Menstrual Pads for women (Regular, 50P)",$15.49,100+ bought in past month,2.8K,4.2
39,B01IAIMZHO,https://www.amazon.com/dp/B01IAIMZHO,U by Kotex Barely There Thin Liners 50 ea (Pack of 5),$29.99,300+ bought in past month,137,4.8
40,B000FFBMRK,https://www.amazon.com/dp/B000FFBMRK,"U by Kotex Clean & Secure Ultra Thin Pads, Regular Absorbency, 176 Count (4 Packs of 44) (Packaging May Vary)",$25.16,2K+ bought in past month,15.6K,4.6
41,B01MSEJ75X,https://www.amazon.com/dp/B01MSEJ75X,"Poise Daily Liners, Incontinence Panty Liners for Bladder Leaks, 2 Drop Very Light Absorbency, Regular Length, 126 Count of Pantiliners, Packaging May Vary",$13.22,5K+ bought in past month,1.7K,4.7
42,B0CKTZ5S1F,https://www.amazon.com/dp/B0CKTZ5S1F,"Poise Daily Microliners, Incontinence Panty Liners for Bladder Leaks, 1 Drop Lightest Absorbency, Regular, 54 Count of Pantiliners",$6.79,6K+ bought in past month,1K,4.6
43,B07RMLFMDM,https://www.amazon.com/dp/B07RMLFMDM,"Kotex Lightdays Liners Regular, Soft and Silky, 192 Count",$22.54,400+ bought in past month,794,4.7
44,B015ZRWDP2,https://www.amazon.com/dp/B015ZRWDP2,"Always Discreet Incontinence Panty Liners for Bladder Leaks, Size 2, Very Light Absorbency, 120 Count",$13.88,5K+ bought in past month,13.3K,4.5
45,B0C1S3QKHD,https://www.amazon.com/dp/B0C1S3QKHD,"LOLA Ultra Thin Liners, 112 Count - Organic Cotton Panty Liners for Women, Hypoallergenic Pads for Women, HSA FSA Approved Products Feminine Care",$33.97,400+ bought in past month,409,4.2
46,B0D73XC13N,https://www.amazon.com/dp/B0D73XC13N,"100% Organic Panty Liners for Women-120ct, Ultra Thin Cotton Cover, Regular Pantiliners, Light Absorbency, Unscented Barely There Pantie Liners (Regular Liner, Size 1, 120ct)",$19.99,2K+ bought in past month,1K,4.1
47,B01N183JDQ,https://www.amazon.com/dp/B01N183JDQ,"Poise Daily Liners, Incontinence Panty Liners for Bladder Leaks, 2 Drop Very Light Absorbency, Long Length, 114 Count of Pantiliners, Packaging May Vary",$15.47,2K+ bought in past month,1.6K,4.6
48,B0DK7RRNJX,https://www.amazon.com/dp/B0DK7RRNJX,"Poise Daily Liners, Incontinence Panty Liners for Bladder Leaks, 2 Drop Very Light Absorbency, Regular Length, 30 Count of Pantiliners, Packaging May Vary",$4.69,2K+ bought in past month,333,4.7
49,B0CP2SRNG8,https://www.amazon.com/dp/B0CP2SRNG8,"Organyc 100% Certified Organic Cotton Inside and Out Tanga Thong Panty Liners, Ultra Thin Liners for Women, Light Flow, 24 Count",$7.67,2K+ bought in past month,227,4.1
50,B01AVIYFJM,https://www.amazon.com/dp/B01AVIYFJM,"Kotex Natural Balance Absorbent Liners, Long, 16 Count (Pack of Six)",$15.68,600+ bought in past month,220,4.5
51,B00F2JKRO8,https://www.amazon.com/dp/B00F2JKRO8,Natracare Normal Panty Liners,$9.69,100+ bought in past month,30,4.3
52,B08CM3FZ1P,https://www.amazon.com/dp/B08CM3FZ1P,"Rael Incontinence Liners for Women, Organic Cotton Cover, Postpartum Essential, Moderate Absorbency, Bladder Control, 4-Layer Core with Leak Guard Technology (Regular, 48 Count)",$9.99,3K+ bought in past month,7.9K,4.3
53,B01DR2ZY7G,https://www.amazon.com/dp/B01DR2ZY7G,44 Poise Long Length Panty Liners Fresh Lightweight- #2 Light Bladder Urine Leakage Protection - 1 Package of 44 Liners,$9.97,1K+ bought in past month,3K,4.7
54,B06XYNPLC1,https://www.amazon.com/dp/B06XYNPLC1,"Lil-Lets Teens Liners - 64 Count Pantyliners for Girls - Thin, Absorbent Liners - Soft & Breathable, Fragrance Free for First Periods - Light Days",$21.99,300+ bought in past month,1.1K,4.5
55,B081HYZFTS,https://www.amazon.com/dp/B081HYZFTS,U by Kotex Curves Panty Liners Regular (Pack of 4)4,$20.00,($0.50$0.50/count),9,4.8
56,B07NDYQZZ7,https://www.amazon.com/dp/B07NDYQZZ7,Flo Bamboo Daily Panty Liners Wrapped + Ultra Thin (24 liners),$5.39,600+ bought in past month,3.1K,4.1
57,B0154QERNA,https://www.amazon.com/dp/B0154QERNA,"Poise Daily Liners, Incontinence Panty Liners for Bladder Leaks, 2 Drop Very Light Absorbency, Long Length, 176 Count of Pantiliners (4 Packs of 44), Packaging May Vary",$21.88,10K+ bought in past month,10.6K,4.7
58,B0CT9LTLYD,https://www.amazon.com/dp/B0CT9LTLYD,"Always Discreet Incontinence Panty Liners for Bladder Leaks, Size 2, Very Light Absorbency, Long Length, 222 Count (2 Packs of 111)",$28.61,1K+ bought in past month,167,4.8
59,B0797HP1FD,https://www.amazon.com/dp/B0797HP1FD,"U by Kotex Balance Daily Wrapped Panty Liners, Light Absorbency, Long, 450 Count (5 Packs of 90) (Packaging May Vary)",$47.50,800+ bought in past month,1K,4.7
60,B0949JRVNQ,https://www.amazon.com/dp/B0949JRVNQ,"Attn: Grace Moderate Incontinence Pads for Women, 28-Pack - High Absorbency, Breathable, Plant-Based - Incontinence Pads for Moderate Bladder Leaks & Sensitive Skin",$15.96,4K+ bought in past month,3.4K,4.2
61,B013AX7QJQ,https://www.amazon.com/dp/B013AX7QJQ,"Veeda Natural Cotton Ultra Thin Panty Liners for Women - Breathable Thin Daily Liners are Always Chlorine, and Toxin Free - Hypoallergenic & Comfortable Pantyliners - 40 Count",$9.49,300+ bought in past month,2.5K,4.1
62,B0CH8XQCBQ,https://www.amazon.com/dp/B0CH8XQCBQ,"SUNKISS Trustplus Booster Pads 15"" x 4"", Extra Absorbency for Adult Incontinence Diapers/Underwears, Odor Control, 26 Count",$15.98,600+ bought in past month,262,4.1
63,B0F1TKB6YQ,https://www.amazon.com/dp/B0F1TKB6YQ,"MODAL Panty Liners for Women, Unscented Sanitary Pads with Wings, Daily Thin Panty Liners, 7.5 Inch(190 mm), Mini, 20 Count",$9.99,($0.50$0.50/count),75,4.4
64,B081HYZFTS,https://www.amazon.com/dp/B081HYZFTS,U by Kotex Curves Panty Liners Regular (Pack of 4)4,$20.00,($0.50$0.50/count),9,4.8
65,B07NDYQZZ7,https://www.amazon.com/dp/B07NDYQZZ7,Flo Bamboo Daily Panty Liners Wrapped + Ultra Thin (24 liners),$5.39,600+ bought in past month,3.1K,4.1
66,B0CT9LTLYD,https://www.amazon.com/dp/B0CT9LTLYD,"Always Discreet Incontinence Panty Liners for Bladder Leaks, Size 2, Very Light Absorbency, Long Length, 222 Count (2 Packs of 111)",$28.61,1K+ bought in past month,167,4.8
67,B0797HP1FD,https://www.amazon.com/dp/B0797HP1FD,"U by Kotex Balance Daily Wrapped Panty Liners, Light Absorbency, Long, 450 Count (5 Packs of 90) (Packaging May Vary)",$47.50,800+ bought in past month,1K,4.7
68,B07SW13PX4,https://www.amazon.com/dp/B07SW13PX4,"Always Discreet Adult Incontinence Pads for Women, Light Absorbency, Regular Length, Postpartum Pads, 30 Count (3 Packs of 30)",$18.87,9K+ bought in past month,5.6K,4.6
69,B09FD1B6JD,https://www.amazon.com/dp/B09FD1B6JD,"SANDIS Premium 100% Organic Panty Liners - Chemical Free Cotton Ultra Thin Liner for Women | Feminine Sanitary Napkins Unscented Everyday Use Leak Protection (Regular, 36 Count, Wrapped)",$8.99,2K+ bought in past month,599,4.2
70,B09LKLNHSG,https://www.amazon.com/dp/B09LKLNHSG,"Carefree Body Shape Pant Liners, Regular, Multicolor Unscented 54 Count (Pack of 2)",$6.68,($0.06$0.06/count),1.7K,4.8
71,B08W21JZJ8,https://www.amazon.com/dp/B08W21JZJ8,"TENA Sensitive Care Panty Liners for Women, Very Light Absorbency, Extra Coverage, Sensitive Care - 300 Count",$35.63,900+ bought in past month,981,4.3
72,B07JYCQV55,https://www.amazon.com/dp/B07JYCQV55,"An item of Poise Very Light Absorbency Long Incontinence Panty Liners, 132 ct.-",$21.84,800+ bought in past month,1.4K,4.7
73,B08YGN7WB3,https://www.amazon.com/dp/B08YGN7WB3,Always Radiant Daily Liners Long,$13.55,700+ bought in past month,206,4.3
74,B0C4MNM526,https://www.amazon.com/dp/B0C4MNM526,"Attn: Grace Panty Liners for Women - 46 Liners – for Light Urinary Incontinence, Bladder Leakage or Postpartum - 100% Breathable & Plant-Based Materials Active Odor Control - Free from Harsh Chemicals",$10.99,3K+ bought in past month,996,4.5
75,B0CKTZ5S1F,https://www.amazon.com/dp/B0CKTZ5S1F,"Poise Daily Microliners, Incontinence Panty Liners for Bladder Leaks, 1 Drop Lightest Absorbency, Regular, 54 Count of Pantiliners",$6.79,6K+ bought in past month,1K,4.6
76,B08CLYK6RC,https://www.amazon.com/dp/B08CLYK6RC,"Organyc 100% Organic Cotton Inside and Out Incontinence Pads for Bladder Leaks, FSA/HSA Eligible, Maximum Flow, 16 Count",$14.16,400+ bought in past month,745,4.1
77,B0CNWNLSQ6,https://www.amazon.com/dp/B0CNWNLSQ6,"Oi | Organic Initiative Incontinence Liner, Organic Cotton Topsheet, Very Light Bladder Leakage, Breathable and Hypoallergenic, Very Light absorbs up to 1.7 floz (7.1"") 60 Liners",$20.99,100+ bought in past month,108,4.0
78,B004DGFFA2,https://www.amazon.com/dp/B004DGFFA2,"Organyc 100% Certified Organic Cotton Inside and Out Folded Panty Liner, Ultra Thin, Light Flow, 24 Count",$7.49,2K+ bought in past month,2.8K,4.0
79,B0D1ZZBJ8D,https://www.amazon.com/dp/B0D1ZZBJ8D,"Organyc 100% Certified Organic Cotton 2 in 1 Panty Liners for Women Fits Thong or Regular Underwear, Light Flow, 20 Count",$7.49,500+ bought in past month,144,4.5
80,B000FFBMZW,https://www.amazon.com/dp/B000FFBMZW,"Poise Daily Liners, Incontinence Panty Liners for Bladder Leaks, 2 Drop Very Light Absorbency, Long Length, 264 Count of Pantiliners (6 Packs of 44), Packaging May Vary",$32.82,4K+ bought in past month,6.3K,4.8
81,B0029NYQEC,https://www.amazon.com/dp/B0029NYQEC,"Always Anti-Bunch Xtra Protection, Panty Liners For Women, Light Absorbency, Regular Length, Leakguard + Rapiddry, Unsented, 100 Count (Packaging May Vary)",N/A,300+ bought in past month,3.2K,4.7
82,B009HL68DG,https://www.amazon.com/dp/B009HL68DG,Panty Liners Curved 30ct - Panty Liner ( Pack of 3),$19.49,100+ bought in past month,710,3.9
83,B074NB6QG1,https://www.amazon.com/dp/B074NB6QG1,"Carefree Acti-Fresh Body Shape Pantiliners Long To Go Unscented - 42 Liners, Pack of 3 (Packaging May Vary)",$18.08,50+ bought in past month,314,4.7
84,B0FHWX7T63,https://www.amazon.com/dp/B0FHWX7T63,"Pixie Organic Cotton Panty Liners for Women - Long Wrapped Pantiliners - Light Absorbency & Ultra-Thin - Leak-Proof, Hypoallergenic & Unscented - Compostable - 88 Count",$16.95,50+ bought in past month,42,4.3
85,B0CPPMGL92,https://www.amazon.com/dp/B0CPPMGL92,"Ultra Thin Sanitary Pantyliners (Regular, 6.1 inch, 120 Counts) - Ultra Thin, Unscented 100% Organic Cotton Panty Liners for Women. Chemical-Free, Extra Soft, Ideal for Sensitive Skin",$19.90,($0.17$0.17/count),194,3.8
86,B08PCYTBW4,https://www.amazon.com/dp/B08PCYTBW4,"wegreeco Reusable Menstrual Pads - Reusable Sanitary Pads | Reusable Panty Liners | Soft Cloth Menstrual Pads - 6 Pack with 1 Cloth Mini Wet Bag (Small, Flower 02)",$12.99,($2.17$2.17/count),11.5K,4.3
87,B07K316RV1,https://www.amazon.com/dp/B07K316RV1,Prevail Pant Liners - LARGE PLUS Elastic Leg Gathers - 13 X 28 inches! Case of 96 Pads (165-8343),$43.50,200+ bought in past month,103,4.6
88,B012IUH2NW,https://www.amazon.com/dp/B012IUH2NW,"Carefree Acti-Fresh Body Shaped Regular Pantiliners, Fresh Scented, 54 Count (Pack of 1) , Package may vary",N/A,2K+ bought in past month,6.5K,4.5
89,B078YGDGPS,https://www.amazon.com/dp/B078YGDGPS,"U by Kotex Barely There Thin Lines - 50 ct, Pack of 4",$20.85,50+ bought in past month,24,4.9
90,B0000BUZWK,https://www.amazon.com/dp/B0000BUZWK,"Poise Daily Liners, Incontinence Panty Liners for Bladder Leaks, 2 Drop Very Light Absorbency, Long Length, 24 Count of Pantiliners, Packaging May Vary",$4.88,2K+ bought in past month,3K,4.7
91,B00005UCPV,https://www.amazon.com/dp/B00005UCPV,"Poise Pantiliners, 26 Count",$8.82,200+ bought in past month,519,4.7
92,B01IULAV6I,https://www.amazon.com/dp/B01IULAV6I,"Always Infinity Feminine Pads for Women, Flexfoam Pads with Wings, Size 4, Overnight Absorbency, Unscented, 78 Count (3 Packs of 26)",$26.91,6K+ bought in past month,10.5K,4.7
93,B07MTLPYC4,https://www.amazon.com/dp/B07MTLPYC4,Cora Ultra Thin Organic Bladder Liners | Incontinence & Postpartum Pads for Women | Panty Liners for Bladder Leaks | Breathable Cotton (72 Long),$17.99,2K+ bought in past month,3.7K,4.4
94,B08ZJN632Z,https://www.amazon.com/dp/B08ZJN632Z,"Livlit Ultra Thin Panty Liners Sanitary Pads, 100% Certified Organic Cotton from Texas, Light Absorbency, Chlorine Free, Unscented, Hypoallergenic Panty Liners for Women (40 Count)",$9.99,1K+ bought in past month,1.8K,3.9
95,B01IULATV0,https://www.amazon.com/dp/B01IULATV0,"Always Infinity Feminine Pads for Women, Flexfoam Pads with Wings, Size 1, Regular Absorbency, Unscented, 108 Count (3 Packs of 36)",$26.91,7K+ bought in past month,6.2K,4.8
96,B00MNSFYMQ,https://www.amazon.com/dp/B00MNSFYMQ,"Always Anti-Bunch Xtra Protection, Panty Liners For Women, Light Absorbency, Long Length, Leakguard + Rapiddry, Unsented, 80 Count",$7.99,50+ bought in past month,854,4.6
97,B074HBVW8Q,https://www.amazon.com/dp/B074HBVW8Q,"365 by Whole Foods Market, Ultra Thin Pantiliners, Made with Organic Cotton, 24 Count",$7.99,($0.33$0.33/count),76,2.6
98,B00G8DDCEE,https://www.amazon.com/dp/B00G8DDCEE,"Always Ultra Thin Pads with Wings, Size 2, Long Super, 42 Count",$8.94,8K+ bought in past month,3.6K,4.8
99,B001E0X7CI,https://www.amazon.com/dp/B001E0X7CI,"Natracare Organic and Natural Tanga Panty Liners, Thong Style, 30 Count, 3 Boxes (90 Liners Total)",$18.75,300+ bought in past month,250,4.0
100,B07N1B96GH,https://www.amazon.com/dp/B07N1B96GH,"Lefresh Organic Cotton Cover Panty Liners | Long, 80 Count | Unscented - Vegan - Chlorine Free - Daily Feminine Pads - Light Absorbency",$15.12,50+ bought in past month,324,4.1
101,B00G8DDBOU,https://www.amazon.com/dp/B00G8DDBOU,"Always Ultra Thin Pads with Wings, Size 1, Regular, 46 Count",$8.94,30K+ bought in past month,22.2K,4.7
102,B09B7QBVH2,https://www.amazon.com/dp/B09B7QBVH2,"Amazon Basics Regular Absorbency Pads for Women, Ultra Thin with Flexi-Wings, Unscented, Size 1, 36 Count, 1 Pack",$4.88,7K+ bought in past month,11.6K,4.5
103,B071VBZLPX,https://www.amazon.com/dp/B071VBZLPX,"Rael Organic Cotton Cover Pads - Regular Absorbency, Unscented, Ultra Thin Pads with Wings for Women (56 Total)",$23.99,30K+ bought in past month,29.1K,4.7
104,B004VS51B0,https://www.amazon.com/dp/B004VS51B0,"CAREFREE Original Regular To-Go Pantiliners, Fresh Scent 20 ea (6 pack)",N/A,100+ bought in past month,2.6K,4.7
105,B0154QERNA,https://www.amazon.com/dp/B0154QERNA,"Poise Daily Liners, Incontinence Panty Liners for Bladder Leaks, 2 Drop Very Light Absorbency, Long Length, 176 Count of Pantiliners (4 Packs of 44), Packaging May Vary",$21.88,10K+ bought in past month,10.6K,4.7
106,B07BQV78B3,https://www.amazon.com/dp/B07BQV78B3,"U by Kotex Clean & Secure Maxi Pads, Heavy Absorbency, 132 Count (3 Packs of 44) (Packaging May Vary)",$32.97,1K+ bought in past month,3.9K,4.5
107,B00JOLSDD2,https://www.amazon.com/dp/B00JOLSDD2,"Always Xtra Protection Daily Liners, Extra Long 34 ea (Pack of 3)",$21.50,300+ bought in past month,619,4.6
108,B0F1ZJF1J9,https://www.amazon.com/dp/B0F1ZJF1J9,Everyday Liners - Long - 100 Liners with Active Coverage and Vital Volumes Tips Card Bundle,$19.95,($0.20$0.20/count),4,4.2
109,B09B84TZTW,https://www.amazon.com/dp/B09B84TZTW,"NutraBlast Balance Shield Panty Liners - Discharge & Odor-Proof Layers (180mm, 40-Pack)",$12.99,100+ bought in past month,355,4.1
110,B00NJNJ6MS,https://www.amazon.com/dp/B00NJNJ6MS,"Carefree Original Thin Panty Liners, Daily Protection, Long, 92 Count (Pack of 1)",$19.27,500+ bought in past month,4.3K,4.5
111,B00NNTV6VM,https://www.amazon.com/dp/B00NNTV6VM,"Carefree Panty Liners for Women, Regular, Wrapped, Unscented, 20ct | Pantiliners, Carefree Liners, Daily Liners for Women, Light Periods and Leaks, 8-Hour Odor Control | 20ct (Packaging May Vary)",N/A,800+ bought in past month,532,4.6
112,B000VI3LNE,https://www.amazon.com/dp/B000VI3LNE,"Natracare Cotton Natural Feminine Ultra Pads Regular With Wings By Natracare, 14 Ea, 14 Count",$10.85,1K+ bought in past month,667,4.5
113,B013AX7QJQ,https://www.amazon.com/dp/B013AX7QJQ,"Veeda Natural Cotton Ultra Thin Panty Liners for Women - Breathable Thin Daily Liners are Always Chlorine, and Toxin Free - Hypoallergenic & Comfortable Pantyliners - 40 Count",$9.49,300+ bought in past month,2.5K,4.1
114,B002OTUYKG,https://www.amazon.com/dp/B002OTUYKG,"Always Thin Daily Panty Liners For Women, Light Absorbency, Unscented, 120 Count",N/A,200+ bought in past month,366,4.5
115,B002LMMGW0,https://www.amazon.com/dp/B002LMMGW0,"natracare Panty Liners, Cotton, 22 ct, 5 Boxes (110 Liners Total)",$28.12,50+ bought in past month,426,4.6
116,B00KXUW2FS,https://www.amazon.com/dp/B00KXUW2FS,"Always Discreet Adult Incontinence Pads for Women, Moderate Absorbency, Long Length, Postpartum Pads, 54 Count",$14.97,10K+ bought in past month,25.7K,4.6
117,B0BG3G11V2,https://www.amazon.com/dp/B0BG3G11V2,"Always Ultra Thin Overnight Pads with Wings, Size 4, Overnight, 96 Count (3 Packs of 32)",$21.96,6K+ bought in past month,1.7K,4.7
118,B00J4YWSEE,https://www.amazon.com/dp/B00J4YWSEE,"Always Ultra Thin Pads with Wings, Size 2, Long Super, 58 Count",$11.44,10K+ bought in past month,20.3K,4.7
119,B0D1ZZBJ8D,https://www.amazon.com/dp/B0D1ZZBJ8D,"Organyc 100% Certified Organic Cotton 2 in 1 Panty Liners for Women Fits Thong or Regular Underwear, Light Flow, 20 Count",$7.49,500+ bought in past month,144,4.5
120,B0F1TKB6YQ,https://www.amazon.com/dp/B0F1TKB6YQ,"MODAL Panty Liners for Women, Unscented Sanitary Pads with Wings, Daily Thin Panty Liners, 7.5 Inch(190 mm), Mini, 20 Count",$9.99,($0.50$0.50/count),75,4.4
