,asin,product_url,title,price,bought,review_count,rating
245,B01HHCEXLA,https://www.amazon.com/dp/B01HHCEXLA,"Rael Reusable Panty Liners Menstrual, Organic Cotton Cover, Period Essential, Cloth Pantyliner for Women, Washable, Soft and Thin, Leak-Free, Washing Machine Safe (5 Count, Brown)",$39.99,100+ bought in past month,1.4K,4.3
246,B07FDG7TLK,https://www.amazon.com/dp/B07FDG7TLK,PEESAFE Panty Liners for Women Daily Use with Aloe Vera (Pack of 50 Liners)| Curvy Design for Extra Comfort | Cottony-Soft Surface with 185mm Wide | Keeps You Dry & Fresh All Day Long,$9.99,($0.20$0.20/count),11.5K,4.3
247,B0C5973QDY,https://www.amazon.com/dp/B0C5973QDY,"Inertia Organic Panty Liners, Organic Oasis: Luxurious Panty Liners for Natural, Chemical-Free Confidence (Pack of 4)…",$19.99,50+ bought in past month,30,4.0
248,B07BQV5D1P,https://www.amazon.com/dp/B07BQV5D1P,"Poise Incontinence Pads & Postpartum Incontinence Pads, 3 Drop Light Absorbency, Long Length, 96 Count (4 Packs of 24), Packaging May Vary",$23.88,10K+ bought in past month,16.3K,4.6
249,B0DH6X7F1S,https://www.amazon.com/dp/B0DH6X7F1S,"Hempress Panty Liners for Women, Organic Pads for Feminine Care, Light Absorbency, Ultra Thin and Comfortable Menstrual Liners, Breathable Cotton, Fragrance Free & Gentle on Sensitive Skin (80 Count)",$21.99,($0.27$0.27/count),46,4.0
250,B0F2P41N8N,https://www.amazon.com/dp/B0F2P41N8N,Veeda Natural Premium Ultra Thin Panty Liners for Women - Breathable Thin Daily Liners are Always Chlorine and Toxin Free - Hypoallergenic Pantiliners - Petite Lite Absorbency - 92 Count,$14.77,50+ bought in past month,646,3.8
251,B08HRRTCZF,https://www.amazon.com/dp/B08HRRTCZF,"Made in EU - Ultra-Thin Reusable Panty Liners (Medium, 7-Pack) – High-Temp Washable Cloth Panty Liners for Women – Durable & Breathable Organic Cotton Keeps You Fresh & Dry for Daily Vaginal Discharge",$57.97,($8.28$8.28/count),4.5K,4.2
252,B00TDYVKPS,https://www.amazon.com/dp/B00TDYVKPS,"Always Thin Daily Liners, Unscented, 120 Liners",$14.49,($0.12$0.12/count),36,4.6
253,B0D1QJL5QY,https://www.amazon.com/dp/B0D1QJL5QY,"Carefree Thong Panty Liners, Unwrapped, Unscented, 196ct (4 Packs of 49ct) + Carefree Thong Regular Liner, Unscented 49 Count",$17.94,N/A,5,5.0
254,B06Y68P348,https://www.amazon.com/dp/B06Y68P348,"SHUYA Natural Cotton Panty Liners for Women Without Wings, Patented Active Oxygen and Anion Strip, Chlorine Free Herbal Scented, Length 155mm-60Count (Pack of 2)",$12.98,($0.22$0.22/count),453,4.5
255,B0D12PKH4L,https://www.amazon.com/dp/B0D12PKH4L,Carefree Panty Liners Extra Long 93ct & Regular Unscented 120ct (Packaging May Vary),$13.65,List: ,N/A,N/A
256,B0F1TKB6YQ,https://www.amazon.com/dp/B0F1TKB6YQ,"MODAL Panty Liners for Women, Unscented Sanitary Pads with Wings, Daily Thin Panty Liners, 7.5 Inch(190 mm), Mini, 20 Count",$9.99,($0.50$0.50/count),75,4.4
257,B0DJFZ3GKT,https://www.amazon.com/dp/B0DJFZ3GKT,"Organic Cotton Reusable Panty Liners for Women & Teens (Medium 7-Pack) – 100% Breathable & High-Temp Washable Cloth Panty Liners for Vaginal Discharge only – Gentle on Skin, Stay Fresh & Dry Daily",$41.97,($6.00$6.00/count),199,4.2
258,B0D1QGZTP9,https://www.amazon.com/dp/B0D1QGZTP9,"Carefree Panty Liners 93ct, Schick Hydro Silk Dermaplaning Tool 3ct - Liners for Odor Control & Leak Protection, Razor for Eyebrows, Face, & Peach Fuzz",$13.32,List: ,N/A,N/A
259,B0CZ7BBYLJ,https://www.amazon.com/dp/B0CZ7BBYLJ,Non-Slip (Premium) Reusable Organic Panty Liners for Women & Teens (Medium 7-Pack) – Breathable High-Temp Washable Cotton Cloth Panty Liners for Vaginal Discharge – Keep You Fresh & Dry for Daily Use,$43.97,($6.28$6.28/count),133,4.2
260,B07VNL15FJ,https://www.amazon.com/dp/B07VNL15FJ,"Oi Girl Organic Panty Liners, Box of 24 Ultra-Thin Panty Liners, Individually-Wrapped",$19.03,($0.79$0.79/count),19,3.5
261,B099DTK1N8,https://www.amazon.com/dp/B099DTK1N8,"wegreeco 6 Pc Reusable Menstrual Pads, Ultra Thin Pantiliners for Thongs, Cloth Pads, Panty Liners for Teens, Women, Nonslip Pantiliners + 1 Pc Wet Bag(Mustard Yellow, Grey, Beige, XS)",$13.99,($2.33$2.33/count),938,4.3
262,B0DFZTY7F8,https://www.amazon.com/dp/B0DFZTY7F8,"LOLA Panty Liners - 56 Count - Cotton Top Sheet & Core, Breathable Daily Liners for Women - Hypoallergenic Unscented Organic Pads for Women",$18.97,2K+ bought in past month,409,4.2
263,B01N30WTQ1,https://www.amazon.com/dp/B01N30WTQ1,Veeda Natural Cotton Ultra Thin Panty Liners for Women - Breathable Thin Daily Liners are Always Chlorine and Toxin Free - Hypoallergenic & Comfortable Pantyliners - 120 Count,$19.87,400+ bought in past month,2.5K,4.1
264,B08PCYTBW4,https://www.amazon.com/dp/B08PCYTBW4,"wegreeco Reusable Menstrual Pads - Reusable Sanitary Pads | Reusable Panty Liners | Soft Cloth Menstrual Pads - 6 Pack with 1 Cloth Mini Wet Bag (Small, Flower 02)",$12.99,($2.17$2.17/count),11.5K,4.3
265,B076HC781C,https://www.amazon.com/dp/B076HC781C,"Oi l Organic Initiative - Ultra-Thin Pantyliner, 100% Certified Organic Cotton | Biodegradable, Free from Chlorine Bleaching, Pesticides, Toxic Chemicals | 80 Liners",$20.99,100+ bought in past month,225,4.0
266,B0D5ZPP9K1,https://www.amazon.com/dp/B0D5ZPP9K1,Micro Pantyliners,$9.99,50+ bought in past month,31,4.1
267,B0CZBBC6P3,https://www.amazon.com/dp/B0CZBBC6P3,Panty Liners for Women Extra Long - 9.6in X 3.1in (30pads) Organic - Cotton Panty Liners for Women - with Wings - Light Incontinence and Light Period Days (30),$18.99,($1.27$1.27/count),35,3.9
268,B0CSD4Q1MY,https://www.amazon.com/dp/B0CSD4Q1MY,"Carefree Panty Liners, Regular Liners, Unwrapped, Unscented, 120ct (Packaging May Vary) & Panty Liners, Long Liners, Unwrapped, Unscented, 92ct (Packaging May Vary)",$13.05,List: ,3,5.0
269,B0DG3L77RZ,https://www.amazon.com/dp/B0DG3L77RZ,"LOLA Non-Toxic Cotton Pads for Women - 36 Count, Regular, Ultra Thin with Wings - Organic Pads & Panty Liners for Women",$24.99,1K+ bought in past month,449,4.5
270,B0FG2HF6KY,https://www.amazon.com/dp/B0FG2HF6KY,"Le Ciel Organic Cotton Panty Liners – Long Length, Breathable and Soft Cover (18 Count)",$14.90,($0.83$0.83/count),N/A,N/A
271,B0D73XC13N,https://www.amazon.com/dp/B0D73XC13N,"100% Organic Panty Liners for Women-120ct, Ultra Thin Cotton Cover, Regular Pantiliners, Light Absorbency, Unscented Barely There Pantie Liners (Regular Liner, Size 1, 120ct)",$19.99,2K+ bought in past month,1K,4.1
272,B083SLDTB7,https://www.amazon.com/dp/B083SLDTB7,Cloth Panty Liners with Discreet Pouch | Reusable Panty Liners Light Flow | Washable Menstrual Pads | Reusable Feminine Pads | Washable Panty Liners | Reusable Panty Liners for Women | Bambaw,$22.49,($4.50$4.50/count),1.5K,4.3
273,B0D1KTCXVK,https://www.amazon.com/dp/B0D1KTCXVK,"Marlow 100% Organic Cotton Liners - Free from Plastic, Fragrance, Dyes, Chlorine-Bleaching, Ultra Soft, Leak Proof, Super Absorbent",$15.27,50+ bought in past month,51,4.0
274,B0CW1P8X6V,https://www.amazon.com/dp/B0CW1P8X6V,"Generic Adhesive Protective Hygiene Try On Stickers for Swimwear,Swimsuits and Lingerie 4x2 inch Panty Liner/Barrier(Pack-100), Small",$7.99,($7.99$7.99/count),32,4.3
275,B0CDQ4J3B1,https://www.amazon.com/dp/B0CDQ4J3B1,"U by Kotex, Balance Regular UItra Thin Pads + Wings, 18 Count",$5.99,100+ bought in past month,6,5.0
276,B079X5KN3Z,https://www.amazon.com/dp/B079X5KN3Z,"Rael Feminine Care, Period Essential for Women - Organic Cotton Cover Regular & Overnight Pads for Women, Regular Panty Liners and Feminine Wipes",$24.99,900+ bought in past month,2.4K,4.8
277,B01LXNFG4K,https://www.amazon.com/dp/B01LXNFG4K,10PCS 8 Inch Reusable Washable Menstrual Pads Sanitary Pads Panty Liner,$13.99,50+ bought in past month,1.4K,4.4
278,B091JGY2YP,https://www.amazon.com/dp/B091JGY2YP,"Rael Disposable Underwear for Women, Organic Cotton Cover - Incontinence Pads, Postpartum Essentials, Disposable Underwear, Unscented, Maximum Coverage (Size S-M, 12 Count)",$18.61,6K+ bought in past month,5.6K,4.7
279,B0FHDV3ZP5,https://www.amazon.com/dp/B0FHDV3ZP5,Seamless Underwear for Women 3 Pack V Waisted No Show Panty Liners Invisible Breathable Concealer Workout Underwear,$17.99,List: ,16,3.9
280,B09JNDLMBD,https://www.amazon.com/dp/B09JNDLMBD,"Langsprit Absorbent Reusable Menstrual Sanitary Pads/Washable Cloth Menstrual Period Pads,Reusable Panty Liners(Winter,S)",$9.87,50+ bought in past month,5.7K,4.4
281,B0DZ2BX5YY,https://www.amazon.com/dp/B0DZ2BX5YY,"PHOGARY Reusable Menstrual Pad, 7 Packs Washable Overnight Cloth Panty Liners with 1 Wet Bag, Sanitary Pads Wings for Heavy Flow",$14.99,($60.71$60.71/ounce),2,2.4
282,B01HW6I4UW,https://www.amazon.com/dp/B01HW6I4UW,Poise Ultra Thin Pads - 24 in Pack - Absorbancy #3 - Long Length,$12.90,900+ bought in past month,1.2K,4.5
283,B0DQGPDLF8,https://www.amazon.com/dp/B0DQGPDLF8,"12 Pack Mama Cloth/Menstrual Pads/Reusable Sanitary Pads Panty Liners for Thongs,7 inch Length by 5 inch Width with Wing,Unscented",$18.99,($1.58$1.58/count),N/A,N/A
284,B09TDRGLJM,https://www.amazon.com/dp/B09TDRGLJM,"Cloth Mama Cloth/Menstrual Pads/Reusable Sanitary Pads Panty Liners for Thongs,7 inch Length by 5 inch Width with Wing (10 Pieces Set)",$16.99,($16.99$16.99/count),106,4.1
285,B0CW7HWBVL,https://www.amazon.com/dp/B0CW7HWBVL,"Carefree Ultra Thin Pads for Women, Super/Long Pads with Wings, 84ct (3 Packs of 28ct) | Carefree Feminine Care, Period Care & Postpartum | 84ct (3 Packs of 28ct)",$20.04,1K+ bought in past month,346,4.7
286,B099DTK1N8,https://www.amazon.com/dp/B099DTK1N8,"wegreeco 6 Pc Reusable Menstrual Pads, Ultra Thin Pantiliners for Thongs, Cloth Pads, Panty Liners for Teens, Women, Nonslip Pantiliners + 1 Pc Wet Bag(Mustard Yellow, Grey, Beige, XS)",$13.99,($2.33$2.33/count),938,4.3
287,B0FFMZF6V6,https://www.amazon.com/dp/B0FFMZF6V6,"Panty Line Cover - Ultra-Thin Intimate Line Concealer Pads – Skin-Friendly Panty Cover for Yoga Pants,Leggings & Skinny Jeans | Ultra-Soft, Seamless & Breathable Design - 5 Count",$9.99,($2.00$2.00/count),5,2.0
288,B07RFFGKNH,https://www.amazon.com/dp/B07RFFGKNH,"Teamoy 10pcs Cloth Panty Liners, Reusable Sanitary Pads with Wet bag, Washable Cloth Menstrual Pads with Charcoal Absorbency Layers (Country Style, 3pcs×7.9''+4pcs×10''+3pcs×11.6''), 11 Piece Set",$22.49,($2.25$2.25/count),7K,4.5
289,B0736YKRRG,https://www.amazon.com/dp/B0736YKRRG,7pcs/Set Reusable Menstrual Pads Including 1pc Mini Wet Bag +6pcs Bamboo Charcoal Cloth Menstrual Incontinence Pads/Reusable Sanitary/Mama Panty Liners (All Randomly Prints),$8.28,1K+ bought in past month,7K,4.2
290,B0FDR82QRJ,https://www.amazon.com/dp/B0FDR82QRJ,"Ona Renewals Perineal Pad Panty Liners for Women, Postpartum Essentials, Witch Hazel Full Coverage Cooling Pads, Hemorrhoid Treatment, Fragrance Free, 30 Ct Pack of 1",$7.99,300+ bought in past month,30,4.9
291,B001E8DA54,https://www.amazon.com/dp/B001E8DA54,"GladRags Reusable Pantyliner (1-Pack) - 100% Cotton Reusable Menstrual Pad, Washable Absorbent Pantyliner, Light Flow Period Pads, Washing Machine Safe",$12.49,($12.49$12.49/count),4,3.3
292,B081CKWG7L,https://www.amazon.com/dp/B081CKWG7L,"wegreeco Charcoal Reusable Menstrual Pads - Reusable Sanitary Pads | Reusable Panty Liners | Soft Cloth Menstrual Pad- 6 Pack with 1 Cloth Mini Wet Bag (Small, Black)",$12.99,($2.17$2.17/count),11.5K,4.3
293,B077JFVS6S,https://www.amazon.com/dp/B077JFVS6S,"wegreeco Charcoal Reusable Menstrual Pads for Women - Reusable Sanitary Pads | Reusable Panty Liners | Soft Cloth Menstrual Pads - 5 Pack, 1 Cloth Wet Bag (Large, Dynamic)",$9.35,($1.87$1.87/count),3.1K,4.4
294,B07MDB2N2P,https://www.amazon.com/dp/B07MDB2N2P,"10 Pcs Reusable Menstrual Pad Set Including 1Pc Mini Wet Bag + 9Pcs Light Flow Daily Use Waterproof Mama Cloth Sanitary Napkin Pads Menstrual Pads (Panty Set, Panty Liner Bamboo Charcoal)",$13.29,($1.33$1.33/count),187,4.4
295,B0CNWNLSQ6,https://www.amazon.com/dp/B0CNWNLSQ6,"Oi | Organic Initiative Incontinence Liner, Organic Cotton Topsheet, Very Light Bladder Leakage, Breathable and Hypoallergenic, Very Light absorbs up to 1.7 floz (7.1"") 60 Liners",$20.99,100+ bought in past month,108,4.0
296,B07S2CQ2P6,https://www.amazon.com/dp/B07S2CQ2P6,7pcs Pack Cloth Pads Including 1pc Mini Wet Bag +6pcs Bamboo Charcoal Cloth Reusable Menstrual Pads/Reusable Sanitary Pad/Mama Panty Liners (All Randomly Prints),$8.28,200+ bought in past month,1.2K,4.3
297,B0C867QKHV,https://www.amazon.com/dp/B0C867QKHV,RedDrop Tween Everyday Pads - Ideal for Girls Experiencing Discharge or Unexpected Bleeding - Reliable Backup for in-Between Days,$9.99,400+ bought in past month,112,4.6
298,B08QKZ4H65,https://www.amazon.com/dp/B08QKZ4H65,"One by Poise Feminine Pads with Wings (2-in-1 Period & Bladder Leakage Pad for Women), Regular, Heavy Absorbency for Period Flow, Light Absorbency for Bladder Leaks, 18 Count",$6.99,500+ bought in past month,7.2K,4.6
299,B0D2KDH9HL,https://www.amazon.com/dp/B0D2KDH9HL,"First Period Pal Pack to-Go Kit | 24 pcs | First Period Kit for Tweens | Teen Period Kit| Discrete Period Bag, Pads, Panty Liners, Period Kits for Tweens 10-12 (Hearts)",$16.98,600+ bought in past month,283,4.8
